### DISCUSSION TITLE
AT commands

### DISCUSSION THREAD

**Discussion by nagyrobi** [dzurikmiroslav/esp32-evse#130] [General]
Looking through the [AT commands list](https://dzurikmiroslav.github.io/esp32-evse-docs/20-software/AT-Commands/), some questions, observations, suggestions below.

AT+TEMP should return the discrete sensors too. Or maybe implement separately an AT+TEMPDETAIL returning something like this:

`+TEMP=<count>,<sn>,<val>,...`

Parameter | Access | Type | Description
-- | -- | -- | --
`<count>` | RO | uint8 | Count of temperature sensors
`<sn>` | RO | string | Serial number of Dallas sensor
`<val>` | RO | int32 | Remperature in dg.C*100

Example
```
AT+TEMPDETAIL?
+TEMP=1,81435465462dfdt48,2368
OK

AT+TEMPDETAIL?
+TEMP=2,81435465462dfdt48,2368,81435465462dfdt49,2562
OK

AT+TEMPDETAIL?
+TEMP=0
OK
```

Goal is to be able to recognize the sensors by their serial numbers before use.

---

AT+EMETERTOTCONSUM should not error when values different from 0 are being set, because it could be used to [set back the total consumption value to a certain number](https://github.com/dzurikmiroslav/esp32-evse/issues/95).
Simply accept any positive number if current value is 0 (to add some protection against overwriting an existing measurement), 0 is just 0. No need for any range.

---

Some sensors should support periodic updates without sending a request command.

For example something like AT+EMETERPOWERUPD:

Command | Return Value | Return Code
-- | -- | --
`AT+EMETERPOWERUPD?` | `+EMETERPOWERUPD=<time>` | `OK`
`AT+EMETERPOWERUPD=?` | Show refresh value in ms for the command |

Parameter | Access | Type | Description
-- | -- | -- | --
`<time>` | RO | uint16 | Refresh time in ms*100

Example
```
AT+EMETERPOWERUPD=3
OK

AT+EMETERPOWERUPD?
Refresh of EMETERPOWER is 300ms
300

AT+EMETERPOWERUPD=0
OK

AT+EMETERPOWERUPD?
Refresh of EMETERPOWER is disabled
0
```

Would automatically send `+EMETERPOWER=11085` every 300 ms without having to ask with `AT+EMETERPOWER?` every time. This would save processing time on the both sides when frequent updates would be needed.

Suggested sensors with this feature:
EMETERPOWER
EMETERSESTIME
EMETERCHTIME
EMETERCONSUM
EMETERTOTCONSUM
EMETERVOLTAGE
EMETERCURRENT
WIFISTACONN
HEAP
TEMP and the TEMPDETAIL-like
TIME

We would need independent setting of refresh rates for the sensors because for example you'd probably want time only once per minute if you're showing a simple hh:mm clock on the display, and you'd want to display power every second only during charging, and you'd probably want to display voltages and currents only on an "advanced measurements" screen every 100ms only when that screen is shown, otherwise stop quering them.
I think a resolution of 100ms would be enough for everybody. Default 0 = disabled.

**Comment by dzurikmiroslav** [comment]
### Temperature sensor

I not plan via any API publish sensors serial number. Because you don't know address during assembling PCB and you don't know which is sensor. Yes you can test sensor before assembling and remember its address, but this is very special access.

Typical use-case for temperature sensors is place on PCB next to all AC contactors and access them as a field that gives min/max/avg temperature. When any sensor reach threshold temperature will stop or reduce charging power.

### Energy meter

It's for security reason you can only reset total consumption. When I am studding some RS485 energy meters, they have no way to reset total consumption. Some have only reset partial consumption, not write concrete value.

### Periodic update

AT commands usually work as master/slave communication. Master are querying slave device, EVSE is slave device. With the Nextion display it was more like the opposite approach to EVSE was master and Nextion slave. 

The slave should only respond to request. Otherwise, the master might process an unexpected response during polling. At least on RS485 interface, where is half-duplex communication.

Implementation of Nextion `sub xxx` pattern was very demanding and unsustainable with many variables.

**Comment by nagyrobi** [comment]
Well, what's the point of implementing AT commands so strictly then, when we already have ModBUS which is a purely master/slave prorocol. All data and polling is available in ModBUS. You could just simply allow running two parrallel instances of that (or even TCP).

AT should be a bit more flexible. Periodic update should be supported and disabled by default. Evse as slave shouldn't worry that master might process an unexpected response during polling, it's master's responsibility, if that's the case, then master simply don't turn on periodic update.
I can inplement in ESPHome an async master to process any incoming respose at any time. Why loose flexibility?

**Comment by dzurikmiroslav** [comment]
Back in time, here was AT commands with Modbus api. But I decided not to develop AT commands, because they enabled the same functionality as Modbus :)

Nowadays I found out, that Modbus api is not suitable for all interaction from HMI. Transferring string in Modbus is problem, and transferring string list with unknown length is bigger problem (WiFi AP scan).

For AT I am using this library https://github.com/marcinbor85/cAT/blob/master/example/unsolicited.c If it will be possible triggering unsolicited commands without extra definitions of commands. I can try implement subscribe command like: `AT+SUB="ENABLED",1000`.
But there will be value periodically published in interval, not only on change like Nextion API (I don't want implement again this totally unigeneric stuff like https://github.com/dzurikmiroslav/esp32-evse/blob/v1.2.3/components/serial/src/serial_nextion.c#L382)

**Reply by nagyrobi** [reply]
Yes that would be the goal, but individually configurable timings for the sensors above would be great.

**Reply by dzurikmiroslav** [reply]
Just added in master SUB/UNSUB commands for periodical reading https://github.com/dzurikmiroslav/esp32-evse/wiki/AT-commands#atsub

**Reply by nagyrobi** [reply]
Thank you!!!

**Comment by nagyrobi** [comment]
While experimenting with the AT commands, I noticed that the board doesn't send updated values when they are changed from the EVSE side. (intending to make an ESPHome component for the entire AT commands set)

For example, if I change the charging current slider or the enabled switch in the web UI, these are not reflected on the uart port at all. 
I know I can use subscribe to poll these values too, but subscribing is more intended to be used for emeter-type data (show a graphic meter with near realtime current or voltage values), using sub for current slider or the enabled switch is a bit overkill.

Would be nice for these settings to be able to just push the change of these settings automatically from the EVSE side without any query. That would reflect the settings changes made in the web ui instantly on the AT-connected display. 
Because if I change anything on the display, that reflects instantly in the web UI. Would be nice to have a consistent experience in both directions.

Also, what's missing is the ERROR bitmasked value. The numeric value is enough, I can decode the bitmask on the client side. This should also be pushed automatically without needing a query so the errors can show up instantly (but can be queried also to eg. refresh the state at display boot).

An Uptime sensor is missing too.

**Reply by dzurikmiroslav** [reply]
I forgot error & uptime clock, I will add...
But as I wrote previously, I don't want to implement ungeneric stuff like in Nextion api. 
In Nextion on change emitting is implemented by manually comparing each current value with previously stored value, https://github.com/dzurikmiroslav/esp32-evse/blob/v1.2.3/components/serial/src/serial_nextion.c#L382

Nextion display has limited performance against ESP32, but LVGL display mostly run on ESP32. So I think it doesn't matter where this comparison is made...

The only disadvantage is the repeating UART data transfer, but I think with a baud rate of 115200 it doesn't cost much...

**Reply by nagyrobi** [reply]
What comparison?
I just need an instant notification when a value changes eg. by user interaction. Changes the switch, drags the slider. No compare, just send the value when event occurs...?

Repeated comparison adds delay either side...

**Reply by nagyrobi** [reply]
Found a bug, EMETERTOTCONSUM reports 0 despite not being 0 on the device itself:

```
[18:56:19.001][D][uart_debug:158]: >>> "AT+EMETERCONSUM?\r\n"
[18:56:19.013][D][uart_debug:158]: <<< "\n"
[18:56:19.066][D][uart_debug:158]: <<< "\r\n"
[18:56:19.076][D][sensor:131]: 'Consumption': Sending state 3033.00000 Wh with 0 decimals of accuracy
[18:56:19.079][D][uart_debug:158]: <<< "+EMETERCONSUM=3033\r\n"
[18:56:19.092][D][uart_debug:158]: <<< "\r\n"
[18:56:19.103][D][uart_debug:158]: <<< "OK\r"
[18:56:19.115][D][uart_debug:158]: >>> "AT+EMETERTOTCONSUM?\r\n"
[18:56:19.127][D][uart_debug:158]: <<< "\n"
[18:56:19.186][D][uart_debug:158]: <<< "\r\n"
[18:56:19.198][D][sensor:131]: 'Total Consumption': Sending state 0.00000 Wh with 0 decimals of accuracy
[18:56:19.203][D][uart_debug:158]: <<< "+EMETERTOTCONSUM=0\r\n"
[18:56:19.215][D][uart_debug:158]: <<< "\r\n"
[18:56:19.226][D][uart_debug:158]: <<< "OK\r"
```

**Reply by nagyrobi** [reply]
One more suggestion. Would be nice to print after EVSE board boot and AT commands module started, notification for example `+READY`. This to detect on the client side that the board has finished rebooting, and re-apply the SUB commands (because they are lost after reboot).

**Reply by dzurikmiroslav** [reply]
Good point, on start will emit `RDY\n`.

Another suggestion, I have implemented workaround for emitting `<CR><LF>` sequence ("\r\n"):
```c
static int write_char(char ch)
{
    if (ch == 10) {
        uart_write_bytes(port, "\r\n", 2);
    } else {
        uart_write_bytes(port, &ch, 1);
    }

    return 1;
}
```

AT library only emitting only `<LF>` after commands, but I am think `<CR><LF>` is not necessary?

**Reply by nagyrobi** [reply]
I think one type of new line delimiter used consistently is enough. Choose which one you like, I guess keeping just `<LF>` is less expensive.

**Reply by nagyrobi** [reply]
Have experience with high baudrates? Would it affect the EVSE in any way?
With baudrate 115200, sending an AT command to EVSE and processing its response is about 300-500ms (running on an esp32-s3). It not the client bottleneck because for example voltage and current response contains 3 values, processing these separately from the same response costs less than 10ms for each. So the roundtrip of sending an AT command to the EVSE and expecting for the response seems very long.
Increasing baudrate to 921600 reduces the process time per command to about 100-150ms.
Is there any delay introduced in the AT library maybe? Of course subscribe works better, but requests are slow.
Nextion seemed to be faster.

**Reply by dzurikmiroslav** [reply]
The library https://github.com/marcinbor85/cAT has designed reading input via `getc`, single character. But in IDF is has only method `uart_read_bytes` for reading array. Probably some locking and other checks causing delay.
I will try to optimize this...

**Reply by nagyrobi** [reply]
WIP: https://github.com/nagyrobi/esp32evse-esphome

**Reply by nagyrobi** [reply]
one more missing binary parameter is "Charging limit reached" (from Nextion's `limReach`).

**Comment by nagyrobi** [comment]
Ok, here's a more serious issue.

If I subscribe to many commands, some will be lost over time.
See log below. At start I subscribe to +STATE and +ENABLE to be able to closely monitor these most important variables. EVSE is in state A.
Then i switch with simulator to state B, this is correctly seen in the stream of data coming from EVSE.
Then after I switch to state C, and when I detect that, I subscribe to 5 EMETER commands because I want to show these on display during charging. These induce a flow of data which don't seem to let any more +STATE and +ENABLE subscribed responses to fit in.
This is problematic because without +STATE refreshes, I can't detect when car finished charging, and can't unsubscribe from EMETERs.

Tried with baudrates 115200 and 921600, it doesn't influence the behavior. If I only subscribe like that during charging to, say EMETERPOWER, it works as expected.

+STATE and +ENABLE are the most important to control the unit in real time, these should never be lost. Actually none should, but not sure if there would be a priority logic these should be the first ones.

[logs_esp32-evse_esphome-lvgl_display_run.txt](https://github.com/user-attachments/files/22563476/logs_esp32-evse_esphome-lvgl_display_run.txt)

**Comment by dzurikmiroslav** [comment]
I just commit to master some AT features:
- New AT commands: ERROR, UPTIME, LIMREACH
- AT ready message RDY
- Reading delay optimalization
- Fix skip emit subscribed commands

**Reply by dzurikmiroslav** [reply]
BTW, for installing you cane use new OTA feature, the OTA channels :)

1. Uncomment **bleeding edge** in `board.yaml`
2. Reboot
3. In System / Firmware / Channel select **bleeding edge**
4. Check for update & Install update (version 92716aa has been recently built)

**Reply by nagyrobi** [reply]
Newline character changed?

**Reply by dzurikmiroslav** [reply]
I am trying to explain:
AT library say, it's CRLF and LF compatible. Character '\n' submit commands, when in input occur also character '\r', will terminating "\r\n" in response, otherwise only '\n'.

Previously I had in library interface workaround in `read_char` and `write_char` function:
```c
int write_char(char ch)
{
    if (ch == 10) {
        uart_write_bytes(port, "\r\n", 2);
    } else {
        uart_write_bytes(port, &ch, 1);
    }
...
```
```c
int read_char(char* ch)
{
...
      if (*ch == 13) {
          *ch = 10;
      }
...
```

Currently I remove this workaround from `write_char` function.
It would also be good to remove this workaround from `read_char`, but I don't know yet how to debug AT api, because all serial monitors handle Enter key as '\r' character...

Diff:
https://github.com/dzurikmiroslav/esp32-evse/commit/92716aaf280d25ea3e4eed78e4c81855d4e71dba#diff-00f119b4be708bcb35c166cdc0c8fcbe5b8d11a64e1a0e4cca86d2f98a152f1e

**Reply by dzurikmiroslav** [reply]
I modify cat library to accept '\r' as command delimiter (OTA bleeding edge e1e0838)

**Reply by nagyrobi** [reply]
So which one do you recommend best to use?

**Reply by dzurikmiroslav** [reply]
I am no sure yet, currently prefer only '\n'

**Reply by nagyrobi** [reply]
When enabling AT commands from the web UI serial settings, it can be properly detected:
```
[22:53:06.418][D][uart_debug:158]: <<< "RDY\n"
```
However at boot it's not detected because:
```
"\x00\xFC\x01\xFE\x00\xFE\x00\xFC\x00\xFC\x00\xFE\x00\xFE\x01\xFE\x00\xFD\x01\xFF\x00\xFC\x01\xFF\x00\xFE\x00\xFE\x00\xFF\x00\xFF\x00\xFF\x01\xFC\x00\xFF\x00\xFE\x00\xFF\x00\xFF\x00\xFF\x00\xFF\x00\xFE\x00\xFF\x00\xFE\x00\xFE\x01\xFE\x00\xFF\x00\xFE\x00\xFE\x01\xFF\x00\xFF\x00\xFF\x00\xFF\x00\xFE\x00\xFE\x00\xFC\x00\xFE\x00\xFF\x00\xFF\x01\xFF\x00\xFE\x00\xFF\x00\xFE\x00\xFF\x00\xFF\x00\xFC\x00\xFF\x00\xFE\x00\xFF\x00\xFF\x00\xFD\x00\xFFRDY\n"
[22:54:42.026][D][esp32evse:984]: Unhandled line: 
```
It's mangled together on the same line with the previous garbage line printed by the ESP after boot.
Please add one or two `\n` before `RDY` so it's clearly differentiated from anyting that was before on the line, like boot garbage output.

**Reply by nagyrobi** [reply]
Otherwise works nice. Dedicated ESPHome custom component and a few displays config examples on the way...

**Reply by dzurikmiroslav** [reply]
Added `"\n\n"` before `RDY`. Changes are in last bleeding edge OTA.

I plan to focus now on extending WiFi settings as static IP & hostname...

**Reply by nagyrobi** [reply]
> Added `"\n\n"` before `RDY`. Changes are in last bleeding edge OTA.

Works now at boot, thank you.

**Reply by nagyrobi** [reply]
There are users wanting to use this. Would you consider releasing a patch version with v2.0.1 for this?

**Reply by dzurikmiroslav** [reply]
Yes, I will do it

**Comment by nagyrobi** [comment]
>  BTW, for installing you cane use new OTA feature, the OTA channels :)
>  
>      1. Uncomment **bleeding edge** in `board.yaml`
>      2. Reboot
>      3. In System / Firmware / Channel select **bleeding edge**
>      4. Check for update & Install update has been recently built

Doesn't work for me.

Keep getting this, no matter which channel I select:

```
E (14:13:38.444) esp-tls-mbedtls: mbedtls_ssl_setup returned -0x7F00
E (14:13:38.446) esp-tls: create_ssl_handle failed
E (14:13:38.447) esp-tls: Failed to open new connection
E (14:13:38.448) transport_base: Failed to open a new connection
E (14:13:38.452) HTTP_CLIENT: Connection failed, sock < 0
E (14:13:38.453) ota: Failed to open HTTP connection: ESP_ERR_HTTP_CONNECT
W (14:13:38.457) httpd_txrx: httpd_resp_send_err: 404 Not Found - Nothing matches the given URI
W (14:13:38.468) httpd_uri: httpd_uri: uri handler execution failed
```

Packet capture shows that it does connect to Github:

```
14:13:38.424487 IP (tos 0x0, ttl 64, id 928, offset 0, flags [none], proto TCP (6), length 44)
    esp32-evse-2.local.63154 > cdn-185-199-108-153.github.com.https: Flags [S], cksum 0xc244 (correct), seq 3928765197, win 5760, options [mss 1440], length 0
14:13:38.431628 IP (tos 0x0, ttl 58, id 405, offset 0, flags [none], proto TCP (6), length 44)
    cdn-185-199-108-153.github.com.https > esp32-evse-2.local.63154: Flags [S.], cksum 0x2ea8 (correct), seq 665223839, ack 3928765198, win 65535, options [mss 1382], length 0
14:13:38.472519 IP (tos 0x0, ttl 64, id 930, offset 0, flags [none], proto TCP (6), length 40)
    esp32-evse-2.local.63154 > cdn-185-199-108-153.github.com.https: Flags [.], cksum 0x2f97 (correct), ack 1, win 5760, length 0
14:13:38.473823 IP (tos 0x0, ttl 64, id 931, offset 0, flags [none], proto TCP (6), length 40)
    esp32-evse-2.local.63154 > cdn-185-199-108-153.github.com.https: Flags [F.], cksum 0x2f96 (correct), seq 1, ack 1, win 5760, length 0
14:13:38.480532 IP (tos 0x0, ttl 58, id 45339, offset 0, flags [none], proto TCP (6), length 40)
    cdn-185-199-108-153.github.com.https > esp32-evse-2.local.63154: Flags [.], cksum 0x4616 (correct), ack 2, win 65535, length 0
14:13:38.480656 IP (tos 0x0, ttl 58, id 65268, offset 0, flags [none], proto TCP (6), length 40)
    cdn-185-199-108-153.github.com.https > esp32-evse-2.local.63154: Flags [F.], cksum 0x4615 (correct), seq 1, ack 2, win 65535, length 0
14:13:38.498441 IP (tos 0x0, ttl 64, id 936, offset 0, flags [none], proto TCP (6), length 40)
    esp32-evse-2.local.63154 > cdn-185-199-108-153.github.com.https: Flags [.], cksum 0x2f96 (correct), ack 2, win 5759, length 0
```

Config is:

```yaml
ota:
  channels:
    - name: stable
      path: https://dzurikmiroslav.github.io/esp32-evse/ota/stable/esp32s2.json
    - name: testing
      path: https://dzurikmiroslav.github.io/esp32-evse/ota/testing/esp32s2.json
    - name: bleeding edge
      path: https://dzurikmiroslav.github.io/esp32-evse/ota/bleeding-edge/esp32s2.json
```

Opening the paths in the browser give proper response:

```json
{
  "version": "2fbb62f",
  "path": "https://dzurikmiroslav.github.io/esp32-evse/ota/bleeding-edge/esp32s2-evse.ota.bin"
}
```

Opening the path manually in the browser works, I can save the file to my PC and upload to EVSE manually.

**Reply by dzurikmiroslav** [reply]
I facing this issue on ESP32S2, there's not enough RAM available for a https/ssl context. 
Try disable Lua script engine or turn off other features to make available more heap RAM.

**Reply by nagyrobi** [reply]
Oh...

**Reply by nagyrobi** [reply]
May I suggest to generate at https://dzurikmiroslav.github.io/esp32-evse/ a simple index page with links to the 3 binaries for manual download?

**Reply by dzurikmiroslav** [reply]
Yes, I would know that...

**Reply by nagyrobi** [reply]
Would you like a helping hand to make a nice docs site for ESP32-EVSE?
Done parts of the docs site for OpenHASP a few years ago, also contributed to docs site of ESPHome.

**Reply by dzurikmiroslav** [reply]
That would be nice. Personally, I'd rather spend my time programming than writing documentation :)

**Reply by nagyrobi** [reply]
OK, let's split up the work! I can't do good programming but like writing docs so add me as collaborator to your repo or wiki and I'll start up someting.

**Reply by nagyrobi** [reply]
Brudhed up the AT commands page a bit, please check.

**Reply by dzurikmiroslav** [reply]
Look's good to me ;)

**Reply by nagyrobi** [reply]
@dzurikmiroslav how do you like this, as a first migration step?
https://nagyrobi.github.io/esp32-evse-docs/

**Reply by dzurikmiroslav** [reply]
I like it. It's much better to have all the information in one place instead of reading the GitHub wiki.

**Reply by nagyrobi** [reply]
OK. What I suggest, it that I can transfer ownership of the repository to you. And then you give me permissions to manage it. We can accept PRs to the documentation.
After that, turn off the Wiki setting in the main repo so the old Wiki will be disabled.

**Reply by dzurikmiroslav** [reply]
Isn’t it enough to just commit it to the gh-pages branch? Does it need to be a separate repository? I’m not sure how other projects usually do it.

**Reply by nagyrobi** [reply]
As far as I see everybody keeps the docs site separate, see Tasmota or ESPHome, this seems to be the common practice to use a similar repo name, eg like `project-name` for the software and `project-name-docs` for the docs site.
Different contribution rules may apply etc. seems to be more flexile. Eg I don't need any permissions to the project's software repo at all, just the docs site.

**Reply by dzurikmiroslav** [reply]
But then it will have to be on a different URL than the one the project uses: https://dzurikmiroslav.github.io/esp32-evse/. I’ve been using GitHub Pages so far to distribute firmware for OTA updates.

**Reply by dzurikmiroslav** [reply]
But that's actually fine. Docs project is primarily meant to replace the GitHub wiki...

**Reply by nagyrobi** [reply]
could you please delete the dzurikmiroslav/esp32-evse-docs repo? I'd like to transfer the repo from me to you but the name is already occupied

**Reply by dzurikmiroslav** [reply]
sure

**Reply by nagyrobi** [reply]
You need to accept it now (github should have sent an email)

**Reply by nagyrobi** [reply]
Works.

**Reply by nagyrobi** [reply]
I'm starting to brush up the actual md files from now.

**Reply by nagyrobi** [reply]
You can turn off the old Wiki for this repo, I corrected all the links to point to the new docs site.
Simplified the readme too, as I transferred it to the site as welcome page, plus splitted it into hw examples sections.

**Reply by nagyrobi** [reply]
Work is continuous. I will expand docs as we move on.

**Reply by dzurikmiroslav** [reply]
thanks, great, also for editing the README.md file

**Reply by nagyrobi** [reply]
Expanded descriptions. Please read the new sections appeared in the hardware and software sections. If you find any errors, correct or suggest.

**Comment by nagyrobi** [comment]
Despite I set the correct timezone in the UI, the time reported through AT commands seems to be still UTC (not local).

**Reply by dzurikmiroslav** [reply]
Both methods (AT commands and the HTTP response) return the time in UTC format. In the web interface, the time is formatted using JS metod `Intl.DateTimeFormat`, so it displays correctly.

I'm not sure what the best approach is here: should I add a method that returns the time zone name (as has HTTP api), or a method that returns the zone offset in seconds?

**Reply by nagyrobi** [reply]
Best would be to return the local time in AT commands, so no further processing would be required on client side.

However, an offset in seconds would make life a lot easier if we would be required to calculate local time from UTC. Afaik current time is just Epoch in AT response so we would simply need to add the offset.

**Reply by dzurikmiroslav** [reply]
I have added the **`AT+TZ`** https://github.com/dzurikmiroslav/esp32-evse/wiki/AT-Commands#attz command to allow read/write device's timezone, it's in latest bleeding-edge.

Regarding the idea of returning a "local time" in Epoch seconds (UTC + offset), I actually consulted with an AI assistant to review embedded time-management best practices, and we concluded that doing so is a hidden anti-pattern for a few reasons:

* **The Double Offset Risk:** Unix Epoch seconds are inherently UTC. If the device returns pre-shifted seconds and the receiving system parses them using standard functions like `localtime_r()`, it only works if that system has no TZ configured (defaulting to 0). If it ever sets a timezone in the future, the offset will be applied a second time, breaking the clock.
* **Corrupted Metadata:** Pre-shifting seconds forces the system to handle "fake" UTC. The resulting `tm` struct will contain corrupted metadata—claiming the timezone is UTC and Daylight Saving Time is inactive (`tm_isdst=0`), even though the hours/minutes are local. This easily breaks future logging, database sorting, or duration calculations (like `mktime()`).

**Reply by dzurikmiroslav** [reply]
I just realized one important technical detail regarding the `AT+TZ` implementation. 

On the web UI, we use standard human-readable IANA timezone names (e.g., `Europe/Bratislava`). However, to make the native `localtime_r()` function work on the ESP32, the system strictly requires a POSIX timezone string (e.g., `CET-1CEST,M3.5.0,M10.5.0/3`). 

To handle this translation on the device, I have implemented a built-in mapping table lookup: [tz_data.h](https://github.com/dzurikmiroslav/esp32-evse/blob/master/components/protocols/src/tz_data.h)

To save you from having to duplicate this heavy mapping table on the HMI/client side, I think the cleanest approach would be to introduce a new read-only AT command: **`AT+TZRULE?`**.

When called, it will return the exact POSIX rule generated by the device's lookup table:
`+TZRULE="CET-1CEST,M3.5.0,M10.5.0/3"`

**Comment by nagyrobi** [comment]
Added a [small fix](https://github.com/dzurikmiroslav/esp32-evse/commit/fbf780c9d3472b87d16510f5487e1c334c57147c).

**Reply by dzurikmiroslav** [reply]
Dumb mistake :)
